<?xml version="1.0" encoding="UTF-8" ?>
<!DOCTYPE work SYSTEM "corpus-ar6.dtd">
<work>
  <report_series id="IPCC_AR6">
    <title>IPCC Sixth Assessment Report</title>
    <description>IPCC Cycle</description>
    <report id="IPCC_AR6_SR15">
      <title>Special Report: Global Warming of 1.5°C</title>
      <description>Global Warming of 1.5°C</description>
      <doi>10.1017/9781009157940</doi>
      <license>CC-BY-NC-ND 4.0</license>
      <tags>Social Sciences; No poverty</tags>
      <date>2022-06-09</date>
      <pdf>https://www.ipcc.ch/site/assets/uploads/sites/2/2022/06/SR15_Full_Report_HR.pdf</pdf>
      <openalex>W4281382652</openalex>
      <text_division_spm_ts>
        <chapter id="1">
          <title>Summary for Policymakers</title>
          <wiki>https://test.kewl.org/wiki/IPCC:Sr15:Chapter:Spm</wiki>
          <source>https://www.ipcc.ch/sr15/chapter/spm/</source>
          <pdf>https://www.ipcc.ch/site/assets/uploads/sites/2/2022/06/SPM_version_report_HR.pdf</pdf>
          <doi>10.1017/9781009157940.001</doi>
          <openalex>W4281385918</openalex>
          <tags>Confidence; Global warming; Pathways</tags>
        </chapter>
        <chapter id="2">
          <title>Technical Summary</title>
          <wiki>https://test.kewl.org/wiki/IPCC:Sr15:Resources:Technicalsummary</wiki>
          <source>https://www.ipcc.ch/sr15/resources/technicalsummary/</source>
          <pdf>https://www.ipcc.ch/site/assets/uploads/sites/2/2019/05/SR15_TS_High_Res.pdf</pdf>
          <doi>10.1017/9781009157940.002</doi>
          <openalex>W4281400632</openalex>
          <tags>Global warming; Technical potential; Global warming potential</tags>
        </chapter>
      </text_division_spm_ts>
      <text_divisions>
        <text_division id="1">
          <title>Chapters</title>
          <chapters>
            <chapter id="1">
              <title>Framing and Context</title>
              <wiki>https://test.kewl.org/wiki/IPCC:Sr15:Chapter:Chapter-1</wiki>
              <source>https://www.ipcc.ch/sr15/chapter/chapter-1/</source>
              <pdf>https://www.ipcc.ch/site/assets/uploads/sites/2/2022/06/SR15_Chapter_1_HR.pdf</pdf>
              <doi>10.1017/9781009157940.003</doi>
              <openalex>W4281383245</openalex>
              <tags>Global warming; Climate response; Impacts</tags>
            </chapter>
            <chapter id="2">
              <title>Mitigation Pathways Compatible with 1.5°C in the Context of Sustainable Development</title>
              <wiki>https://test.kewl.org/wiki/IPCC:Sr15:Chapter:Chapter-2</wiki>
              <source>https://www.ipcc.ch/sr15/chapter/chapter-2/</source>
              <pdf>https://www.ipcc.ch/site/assets/uploads/sites/2/2022/06/SR15_Chapter_2_HR.pdf</pdf>
              <doi>10.1017/9781009157940.004</doi>
              <openalex>W4281383849</openalex>
              <tags>Pathways; Mitigation pathways; Mitigation</tags>
            </chapter>
            <chapter id="3">
              <title>Impacts of 1.5°C Global Warming on Natural and Human Systems</title>
              <wiki>https://test.kewl.org/wiki/IPCC:Sr15:Chapter:Chapter-3</wiki>
              <source>https://www.ipcc.ch/sr15/chapter/chapter-3/</source>
              <pdf>https://www.ipcc.ch/site/assets/uploads/sites/2/2022/06/SR15_Chapter_3_HR.pdf</pdf>
              <doi>10.1017/9781009157940.005</doi>
              <openalex>W4281384098</openalex>
              <tags>Global warming; Impacts; Climate model</tags>
            </chapter>
            <chapter id="4">
              <title>Strengthening and Implementing the Global Response</title>
              <wiki>https://test.kewl.org/wiki/IPCC:Sr15:Chapter:Chapter-4</wiki>
              <source>https://www.ipcc.ch/sr15/chapter/chapter-4/</source>
              <pdf>https://www.ipcc.ch/site/assets/uploads/sites/2/2022/06/SR15_Chapter_4_HR.pdf</pdf>
              <doi>10.1017/9781009157940.006</doi>
              <openalex>W2935948450</openalex>
              <tags>Adaptation; Climate governance; Climate system</tags>
            </chapter>
            <chapter id="5">
              <title>Sustainable Development, Poverty Eradication and Reducing Inequalities</title>
              <wiki>https://test.kewl.org/wiki/IPCC:Sr15:Chapter:Chapter-5</wiki>
              <source>https://www.ipcc.ch/sr15/chapter/chapter-5/</source>
              <pdf>https://www.ipcc.ch/site/assets/uploads/sites/2/2022/06/SR15_Chapter_5_HR.pdf</pdf>
              <doi>10.1017/9781009157940.007</doi>
              <openalex>W2902431294</openalex>
              <tags>Adaptation; Sustainable development; Climate justice</tags>
            </chapter>
          </chapters>
        </text_division>
      </text_divisions>
    </report>
    <report id="IPCC_AR6_SRCCL">
      <title>Special Report: Climate Change and Land</title>
      <description>Climate Change and Land</description>
      <doi>10.1017/9781009157988</doi>
      <license>CC-BY-NC-ND 4.0</license>
      <tags>Physical Sciences</tags>
      <date>2022-12-08</date>
      <pdf>https://www.ipcc.ch/site/assets/uploads/sites/4/2022/11/SRCCL_Full_Report.pdf</pdf>
      <openalex>W4309402431</openalex>
      <text_division_spm_ts>
        <chapter id="1">
          <title>Summary for Policymakers</title>
          <wiki>https://test.kewl.org/wiki/IPCC:Srccl:Chapter:Summary-for-policymakers</wiki>
          <source>https://www.ipcc.ch/srccl/chapter/summary-for-policymakers/</source>
          <pdf>https://www.ipcc.ch/site/assets/uploads/sites/4/2022/11/SRCCL_SPM.pdf</pdf>
          <doi>10.1017/9781009157988.001</doi>
          <openalex>W4309372022</openalex>
          <tags>Confidence; Land; Land management</tags>
        </chapter>
        <chapter id="2">
          <title>Technical Summary</title>
          <wiki>https://test.kewl.org/wiki/IPCC:Srccl:Chapter:Technical-summary</wiki>
          <source>https://www.ipcc.ch/srccl/chapter/technical-summary/</source>
          <pdf>https://www.ipcc.ch/site/assets/uploads/sites/4/2022/11/SRCCL_Technical-Summary.pdf</pdf>
          <doi>10.1017/9781009157988.002</doi>
          <openalex>W4309402493</openalex>
          <tags>Land; Land-use change; Land-cover change</tags>
        </chapter>
      </text_division_spm_ts>
      <text_divisions>
        <text_division id="1">
          <title>Chapters</title>
          <chapters>
            <chapter id="1">
              <title>Framing and context</title>
              <wiki>https://test.kewl.org/wiki/IPCC:Srccl:Chapter:Chapter-1</wiki>
              <source>https://www.ipcc.ch/srccl/chapter/chapter-1/</source>
              <pdf>https://www.ipcc.ch/site/assets/uploads/sites/4/2022/11/SRCCL_Chapter_1.pdf</pdf>
              <doi>10.1017/9781009157988.003</doi>
              <openalex>W4309402413</openalex>
              <tags>Land; Land use; Land-use change</tags>
            </chapter>
            <chapter id="2">
              <title>Land–climate interactions</title>
              <wiki>https://test.kewl.org/wiki/IPCC:Srccl:Chapter:Chapter-2</wiki>
              <source>https://www.ipcc.ch/srccl/chapter/chapter-2/</source>
              <pdf>https://www.ipcc.ch/site/assets/uploads/sites/4/2022/11/SRCCL_Chapter_2.pdf</pdf>
              <doi>10.1017/9781009157988.004</doi>
              <openalex>W3092635909</openalex>
              <tags>Land; Land-use change; Land use</tags>
            </chapter>
            <chapter id="3">
              <title>Desertification</title>
              <wiki>https://test.kewl.org/wiki/IPCC:Srccl:Chapter:Chapter-3</wiki>
              <source>https://www.ipcc.ch/srccl/chapter/chapter-3/</source>
              <pdf>https://www.ipcc.ch/site/assets/uploads/sites/4/2022/11/SRCCL_Chapter_3.pdf</pdf>
              <doi>10.1017/9781009157988.005</doi>
              <openalex>W4309402514</openalex>
              <tags>Land; Desertification; Land degradation</tags>
            </chapter>
            <chapter id="4">
              <title>Land degradation</title>
              <wiki>https://test.kewl.org/wiki/IPCC:Srccl:Chapter:Chapter-4</wiki>
              <source>https://www.ipcc.ch/srccl/chapter/chapter-4/</source>
              <pdf>https://www.ipcc.ch/site/assets/uploads/sites/4/2022/11/SRCCL_Chapter_4.pdf</pdf>
              <doi>10.1017/9781009157988.006</doi>
              <openalex>W4309402409</openalex>
              <tags>Land; Land degradation; Forest degradation</tags>
            </chapter>
            <chapter id="5">
              <title>Food security</title>
              <wiki>https://test.kewl.org/wiki/IPCC:Srccl:Chapter:Chapter-5</wiki>
              <source>https://www.ipcc.ch/srccl/chapter/chapter-5/</source>
              <pdf>https://www.ipcc.ch/site/assets/uploads/sites/4/2022/11/SRCCL_Chapter_5.pdf</pdf>
              <doi>10.1017/9781009157988.007</doi>
              <openalex>W4309402428</openalex>
              <tags>Food security; Food system; Climate system</tags>
            </chapter>
            <chapter id="6">
              <title>Interlinkages between desertification, land degradation, food security and greenhouse gas fluxes: Synergies, trade-offs and integrated response options</title>
              <wiki>https://test.kewl.org/wiki/IPCC:Srccl:Chapter:Chapter-6</wiki>
              <source>https://www.ipcc.ch/srccl/chapter/chapter-6/</source>
              <pdf>https://www.ipcc.ch/site/assets/uploads/sites/4/2022/11/SRCCL_Chapter_6.pdf</pdf>
              <doi>10.1017/9781009157988.008</doi>
              <openalex>W4309402499</openalex>
              <tags>Land; Land management; Land-use change</tags>
            </chapter>
            <chapter id="7">
              <title>Risk management and decision-making in relation to sustainable development</title>
              <wiki>https://test.kewl.org/wiki/IPCC:Srccl:Chapter:Chapter-7</wiki>
              <source>https://www.ipcc.ch/srccl/chapter/chapter-7/</source>